{"schema":"sns.quest-action.v1","quest_action_id":"QA-20260830T150210000000Z-qst-sim-0003-power-chain-coupling-d87b9baedb19d1bb6702","action_type":"refine_existing","quest_id":"QST-SIM-0003","target_quest_ids":["QST-SIM-0003"],"proposed_by_loop":"weekly-evidence-synthesis","authority":"proposal","rationale":"Couple the accepted receiver-visibility gate to existing power-chain accounting before role-mix claims, then sweep the already-declared eclipse and relay-efficiency variables while retaining the quest falsifier for cases where relay costs reduce host-delivered useful energy.","recorded_at":"2026-08-30T15:02:10Z"}
