{"schema":"sns.quest-action.v1","quest_action_id":"QA-20260830T150210000000Z-qst-arci-0001-disposition-911b21641f7a926941bb","action_type":"no_action","quest_id":"","target_quest_ids":[],"proposed_by_loop":"weekly-evidence-synthesis","authority":"proposal","rationale":"The declared QST-ARCI-0001 v0.1 synthetic-target method and success criteria are substantially satisfied without triggering the bounded grade-reversal falsifier. Weekly does not widen the quest automatically; Monthly should decide completion versus a successor that replaces exactly one missing synthetic dimension with traceable benchmark evidence.","recorded_at":"2026-08-30T15:02:10Z"}
