{"schema":"sns.quest-action.v1","quest_action_id":"QA-20260830T150210000000Z-qst-meta-0001-next-calibration-87c6876ed7dee67f108e","action_type":"refine_existing","quest_id":"QST-META-0001","target_quest_ids":["QST-META-0001"],"proposed_by_loop":"weekly-evidence-synthesis","authority":"proposal","rationale":"Before interpreting the four useful synthetic points as a robust relay region, sweep the loss-model assumptions themselves, especially steering exponent, pointing sigma, conversion/coupling, and control cost, while preserving negative-net cases and the current hardware nonclaim.","recorded_at":"2026-08-30T15:02:10Z"}
